query_name,query_md5,match_name,match_md5,containment,jaccard,intersect_hashes
"CP001071.1 Akkermansia muciniphila ATCC BAA-835, complete genome",f3a90d4e5528864a5bcc8434b0d0c3b1,"CP001071.1 Akkermansia muciniphila ATCC BAA-835, complete genome",f3a90d4e5528864a5bcc8434b0d0c3b1,1,1,2701
"NC_009661.1 Shewanella baltica OS185 plasmid pS18501, complete sequence",09a08691ce52952152f0e866a59f6261,"NC_009661.1 Shewanella baltica OS185 plasmid pS18501, complete sequence",09a08691ce52952152f0e866a59f6261,1,1,5177
"NC_011665.1 Shewanella baltica OS223 plasmid pS22303, complete sequence",38729c6374925585db28916b82a6f513,"NC_009661.1 Shewanella baltica OS185 plasmid pS18501, complete sequence",09a08691ce52952152f0e866a59f6261,0.48281786941580757,0.3206949023586102,2529
"NC_009661.1 Shewanella baltica OS185 plasmid pS18501, complete sequence",09a08691ce52952152f0e866a59f6261,"NC_011665.1 Shewanella baltica OS223 plasmid pS22303, complete sequence",38729c6374925585db28916b82a6f513,0.48850685725323545,0.3206949023586102,2529
"NC_011665.1 Shewanella baltica OS223 plasmid pS22303, complete sequence",38729c6374925585db28916b82a6f513,"NC_011665.1 Shewanella baltica OS223 plasmid pS22303, complete sequence",38729c6374925585db28916b82a6f513,1,1,5238
